{
  "id": "kaykit.character.knight",
  "kind": "character",
  "tags": ["hero", "humanoid"],
  "theme": "dungeon",
  "size": [0.6, 1.8, 0.6],
  "snapPoints": [{ "position": [0, 0, 0], "axis": "y" }],
  "glbUrl": "kits/kaykit/characters/knight.glb",
  "license": "CC0-1.0",
  "source": "kit",
  "animations": ["idle", "walk", "run", "attack", "block", "die"]
}
